"Bucket_Level0","Bucket_Level1","Bucket_Level2","Bucket_Level3","Short_Name","Long_Name","Data_Center_URL","UUID"
"ACADEMIC","","","","URI/GSO/CACS","Center for Atmospheric Chemistry Studies, Graduate School of Oceanography, University of Rhode Island","http://euros.gso.uri.edu/","145cfe82-90cf-4240-898a-5187ae86c2b2"
"ACADEMIC","","","","URI/GSO/MAEWEST","Maewest, Graduate School of Oceanography, University of Rhode Island","http://maewest.gso.uri.edu/","ecca06f2-b8d0-4e8e-8d58-e233086857df"
"ACADEMIC","","","","URI/GSO/PO-RS","Physical Oceanography and Remote Sensing, Graduate School of Oceanography, University of Rhode Island","http://mail.po.gso.uri.edu/","ac2e31b3-e55f-4f8f-ab83-087f5d6b5582"
"ACADEMIC","","","","URI/GSO/PO/RAFOS","RAFOS Float Group, Physical Oceanography Department, Graduate School of Oceanography, University of Rhode Island","http://www.po.gso.uri.edu/rafos/","11e7cbe5-7794-404c-9a79-4c9279cff16c"
"ACADEMIC","","","","URI/GSO","Graduate School of Oceanography, University of Rhode Island","http://www.gso.uri.edu/","69b5ac7e-227c-4b7a-85b5-9927f1d545a7"
"ACADEMIC","","","","URI/NRS","Department of Natural Resources Science, University of Rhode Island","http://nrs.uri.edu/","e18739ea-6699-4b53-a604-1a55da050477"
"ACADEMIC","","","","URI/PLS","Department of Plant Sciences and Entomology, College of the Environment and Life Sciences, University of Rhode Island","http://www.uri.edu/cels/pls/","00eabfc6-2a48-4c76-89ee-76d634479059"
